{
  "$schema": "https://json-schema.org/draft/2020-12/schema",
  "$id": "https://wikicraft/schemas/recipe.schema.json",
  "title": "Receta",
  "description": "Una forma de obtener un item. Un mismo resultado puede tener varias recetas, asi que la receta es una entidad propia y no un campo del item.",

  "allOf": [{ "$ref": "_comun.schema.json#/$defs/entidad" }],

  "type": "object",
  "required": ["id", "tipo", "estacion", "resultado"],
  "properties": {
    "$schema": { "type": "string" },
    "id": { "$ref": "_comun.schema.json#/$defs/id" },
    "tipo": { "const": "receta" },
    "desdeVersion": { "$ref": "_comun.schema.json#/$defs/version" },
    "hastaVersion": { "$ref": "_comun.schema.json#/$defs/version" },
    "etapa": { "$ref": "_comun.schema.json#/$defs/etapa" },
    "relevancia": { "$ref": "_comun.schema.json#/$defs/relevancia" },
    "etiquetas": { "type": "array", "items": { "type": "string" } },

    "estacion": {
      "type": "string",
      "enum": [
        "inventario",
        "mesa_de_trabajo",
        "horno",
        "alto_horno",
        "ahumador",
        "fogata",
        "yunque",
        "mesa_de_herreria",
        "cortador",
        "soporte_para_pociones"
      ]
    },

    "resultado": {
      "type": "object",
      "required": ["item", "cantidad"],
      "additionalProperties": false,
      "properties": {
        "item": { "$ref": "_comun.schema.json#/$defs/referencia" },
        "cantidad": { "$ref": "_comun.schema.json#/$defs/cantidad" }
      }
    },

    "variantePor": {
      "$ref": "_comun.schema.json#/$defs/referencia",
      "description": "Ingrediente que distingue esta receta de las demas del mismo objeto, cuando no se han podido plegar en una sola. Sirve para nombrarla por lo que cambia en vez de por un numero, que no informa de nada."
    },

    "conForma": {
      "type": "boolean",
      "default": true,
      "description": "Si la colocacion en la cuadricula importa. Cuando es false basta con 'ingredientes'."
    },

    "patron": {
      "type": "array",
      "minItems": 1,
      "maxItems": 3,
      "description": "Filas de la cuadricula. Cada caracter es una clave de 'clave'; el espacio es una casilla vacia.",
      "items": {
        "type": "string",
        "minLength": 1,
        "maxLength": 3
      }
    },

    "clave": {
      "type": "object",
      "description": "Que puede ir en cada caracter del patron. Siempre es una LISTA porque el juego admite etiquetas: una casilla que acepta 'cualquier tronco' tiene diecinueve alternativas y no una sola.",
      "patternProperties": {
        "^[A-Z]$": {
          "type": "array",
          "minItems": 1,
          "uniqueItems": true,
          "items": { "$ref": "_comun.schema.json#/$defs/referencia" }
        }
      },
      "additionalProperties": false
    },

    "ingredientes": {
      "type": "array",
      "minItems": 1,
      "description": "Lista plana de materiales. Obligatoria en recetas sin forma; en las que tienen forma se deriva del patron.",
      "items": {
        "type": "object",
        "required": ["opciones", "cantidad"],
        "additionalProperties": false,
        "properties": {
          "opciones": {
            "type": "array",
            "minItems": 1,
            "uniqueItems": true,
            "items": { "$ref": "_comun.schema.json#/$defs/referencia" }
          },
          "cantidad": { "$ref": "_comun.schema.json#/$defs/cantidad" }
        }
      }
    },

    "segundos": {
      "type": "number",
      "exclusiveMinimum": 0,
      "description": "Tiempo de coccion, solo en hornos y similares."
    }
  },
  "additionalProperties": false
}
