{
  "$schema": "../../schemas/recipe.schema.json",
  "id": "wooden_shovel_receta_11",
  "tipo": "receta",
  "etapa": "inicio",
  "relevancia": "baja",
  "resultado": {
    "item": "wooden_shovel",
    "cantidad": 1
  },
  "conForma": true,
  "patron": [
    "A",
    "B",
    "B"
  ],
  "clave": {
    "A": "spruce_planks",
    "B": "stick"
  },
  "estacion": "mesa_de_trabajo"
}
