{
  "$schema": "../../schemas/recipe.schema.json",
  "id": "jungle_hanging_sign_receta",
  "tipo": "receta",
  "etapa": "inicio",
  "relevancia": "baja",
  "resultado": {
    "item": "jungle_hanging_sign",
    "cantidad": 6
  },
  "conForma": true,
  "patron": [
    "A A",
    "BBB",
    "BBB"
  ],
  "clave": {
    "A": "chain",
    "B": "stripped_jungle_log"
  },
  "estacion": "mesa_de_trabajo"
}
