{
  "$schema": "../../schemas/recipe.schema.json",
  "id": "lectern_receta_3",
  "tipo": "receta",
  "etapa": "inicio",
  "relevancia": "baja",
  "resultado": {
    "item": "lectern",
    "cantidad": 1
  },
  "conForma": true,
  "patron": [
    "AAA",
    " B",
    " A"
  ],
  "clave": {
    "A": "bamboo_slab",
    "B": "bookshelf"
  },
  "estacion": "mesa_de_trabajo"
}
