{
  "$schema": "../../schemas/recipe.schema.json",
  "id": "light_blue_bed_receta_con_black_bed",
  "tipo": "receta",
  "etapa": "inicio",
  "relevancia": "baja",
  "resultado": {
    "item": "light_blue_bed",
    "cantidad": 1
  },
  "variantePor": "black_bed",
  "conForma": false,
  "ingredientes": [
    {
      "opciones": [
        "black_bed"
      ],
      "cantidad": 1
    },
    {
      "opciones": [
        "light_blue_dye"
      ],
      "cantidad": 1
    }
  ],
  "estacion": "inventario"
}
