{
  "$schema": "../../schemas/recipe.schema.json",
  "id": "andesite_wall_receta",
  "tipo": "receta",
  "etapa": "inicio",
  "relevancia": "baja",
  "resultado": {
    "item": "andesite_wall",
    "cantidad": 6
  },
  "conForma": true,
  "patron": [
    "AAA",
    "AAA"
  ],
  "clave": {
    "A": [
      "andesite"
    ]
  },
  "estacion": "mesa_de_trabajo"
}
