{
  "$schema": "../../schemas/recipe.schema.json",
  "id": "fire_charge_receta",
  "tipo": "receta",
  "etapa": "inicio",
  "relevancia": "baja",
  "resultado": {
    "item": "fire_charge",
    "cantidad": 3
  },
  "conForma": false,
  "ingredientes": [
    {
      "opciones": [
        "blaze_powder"
      ],
      "cantidad": 1
    },
    {
      "opciones": [
        "coal"
      ],
      "cantidad": 1
    },
    {
      "opciones": [
        "gunpowder"
      ],
      "cantidad": 1
    }
  ],
  "estacion": "inventario"
}
