{
  "$schema": "../../schemas/recipe.schema.json",
  "id": "waxed_oxidized_cut_copper_receta_1",
  "tipo": "receta",
  "etapa": "hierro",
  "relevancia": "baja",
  "resultado": {
    "item": "waxed_oxidized_cut_copper",
    "cantidad": 4
  },
  "conForma": true,
  "patron": [
    "AA",
    "AA"
  ],
  "clave": {
    "A": [
      "waxed_oxidized_copper"
    ]
  },
  "estacion": "inventario"
}
