{
  "$schema": "../../schemas/recipe.schema.json",
  "id": "wooden_sword_receta_7",
  "tipo": "receta",
  "etapa": "inicio",
  "relevancia": "baja",
  "resultado": {
    "item": "wooden_sword",
    "cantidad": 1
  },
  "conForma": true,
  "patron": [
    "A",
    "A",
    "B"
  ],
  "clave": {
    "A": "dark_oak_planks",
    "B": "stick"
  },
  "estacion": "mesa_de_trabajo"
}
