{
  "$schema": "../../schemas/recipe.schema.json",
  "id": "yellow_bed_receta_9",
  "tipo": "receta",
  "etapa": "inicio",
  "relevancia": "baja",
  "resultado": {
    "item": "yellow_bed",
    "cantidad": 1
  },
  "conForma": true,
  "patron": [
    "AAA",
    "BBB"
  ],
  "clave": {
    "A": "yellow_wool",
    "B": "jungle_planks"
  },
  "estacion": "mesa_de_trabajo"
}
