{
  "$schema": "../../schemas/recipe.schema.json",
  "id": "magma_block_receta",
  "tipo": "receta",
  "etapa": "nether",
  "relevancia": "baja",
  "resultado": {
    "item": "magma_block",
    "cantidad": 1
  },
  "conForma": true,
  "patron": [
    "AA",
    "AA"
  ],
  "clave": {
    "A": "magma_cream"
  },
  "estacion": "inventario"
}
