{
  "$schema": "../../schemas/recipe.schema.json",
  "id": "jungle_planks_receta",
  "tipo": "receta",
  "etapa": "inicio",
  "relevancia": "baja",
  "resultado": {
    "item": "jungle_planks",
    "cantidad": 4
  },
  "conForma": false,
  "ingredientes": [
    {
      "opciones": [
        "jungle_log"
      ],
      "cantidad": 1
    }
  ],
  "estacion": "inventario"
}
