{
  "$schema": "../../schemas/recipe.schema.json",
  "id": "chiseled_bookshelf_receta_4",
  "tipo": "receta",
  "etapa": "inicio",
  "relevancia": "baja",
  "resultado": {
    "item": "chiseled_bookshelf",
    "cantidad": 1
  },
  "conForma": true,
  "patron": [
    "AAA",
    "BBB",
    "AAA"
  ],
  "clave": {
    "A": [
      "mangrove_planks"
    ],
    "B": [
      "mangrove_slab"
    ]
  },
  "estacion": "mesa_de_trabajo"
}
