{
  "$schema": "../../schemas/recipe.schema.json",
  "id": "waxed_exposed_copper_receta",
  "tipo": "receta",
  "etapa": "hierro",
  "relevancia": "baja",
  "resultado": {
    "item": "waxed_exposed_copper",
    "cantidad": 1
  },
  "conForma": false,
  "ingredientes": [
    {
      "opciones": [
        "exposed_copper"
      ],
      "cantidad": 1
    },
    {
      "opciones": [
        "honeycomb"
      ],
      "cantidad": 1
    }
  ],
  "estacion": "inventario"
}
