{
  "$schema": "../../schemas/recipe.schema.json",
  "id": "mojang_banner_pattern_receta",
  "tipo": "receta",
  "etapa": "inicio",
  "relevancia": "baja",
  "resultado": {
    "item": "mojang_banner_pattern",
    "cantidad": 1
  },
  "conForma": false,
  "ingredientes": [
    {
      "opciones": [
        "enchanted_golden_apple"
      ],
      "cantidad": 1
    },
    {
      "opciones": [
        "paper"
      ],
      "cantidad": 1
    }
  ],
  "estacion": "inventario"
}
