{
  "$schema": "../../schemas/recipe.schema.json",
  "id": "green_bed_receta_1",
  "tipo": "receta",
  "etapa": "inicio",
  "relevancia": "baja",
  "resultado": {
    "item": "green_bed",
    "cantidad": 1
  },
  "conForma": true,
  "patron": [
    "AAA",
    "BBB"
  ],
  "clave": {
    "A": [
      "green_wool"
    ],
    "B": [
      "acacia_planks",
      "bamboo_planks",
      "birch_planks",
      "cherry_planks",
      "crimson_planks",
      "dark_oak_planks",
      "jungle_planks",
      "mangrove_planks",
      "oak_planks",
      "pale_oak_planks",
      "spruce_planks",
      "warped_planks"
    ]
  },
  "estacion": "mesa_de_trabajo"
}
