{
  "$schema": "../../schemas/recipe.schema.json",
  "id": "smooth_red_sandstone_stairs_receta",
  "tipo": "receta",
  "etapa": "inicio",
  "relevancia": "baja",
  "resultado": {
    "item": "smooth_red_sandstone_stairs",
    "cantidad": 4
  },
  "conForma": true,
  "patron": [
    "A",
    "AA",
    "AAA"
  ],
  "clave": {
    "A": [
      "smooth_red_sandstone"
    ]
  },
  "estacion": "mesa_de_trabajo"
}
